{"allowed_tasks":["walk-forward-sweep","cost-sensitivity-shock"],"broker_access_permitted":false,"cancellation_policy":{"checkpoint_interval_seconds":300,"stop_on_first_error":true},"created_at":"2026-01-01T20:00:00Z","expires_at":"2026-01-02T06:00:00Z","mandate_id":"mandate.nightly.001","mandate_schema_version":1,"owner":"operator.solo","resource_limits":{"max_cpu_cores":4,"max_duration_seconds":14400,"max_memory_mb":8192,"max_storage_bytes":104857600}}
